{"key":"BMFBOVESPA-RENV11","exchange":"BMFBOVESPA","ticker":"RENV11","market":"BRAZIL","name":"CPV Energia Fundo De Investimento Imobiliario Responsabilidade Limitada","isin":"BRRENVCTF003","status":"listed","url":"https://cdn.jsdelivr.net/gh/MrChartist/global-stock-logos@main/api/v1/companies/brazil/RENV11.json"}