{"key":"BMFBOVESPA-PAGS34","exchange":"BMFBOVESPA","ticker":"PAGS34","market":"BRAZIL","name":"PagSeguro Digital Ltd. Shs A Unsponsored Brazilian Depositary Receipt Repr 0.2 Sh A","isin":"BRPAGSBDR006","status":"listed","url":"https://cdn.jsdelivr.net/gh/MrChartist/global-stock-logos@main/api/v1/companies/brazil/PAGS34.json"}